{
  "knowledge_manifest_version": "1.0",
  "corpus_id": "pyaedt_official_minimal",
  "retrieved_at": "2026-08-21T02:00:00Z",
  "allowed_hosts": [
    "aedt.docs.pyansys.com",
    "examples.aedt.docs.pyansys.com"
  ],
  "request_timeout_seconds": 30,
  "max_bytes_per_document": 5000000,
  "chunk_max_characters": 2400,
  "documents": [
    {
      "source_id": "pyaedt_hfss_create_setup",
      "url": "https://aedt.docs.pyansys.com/version/stable/API/_autosummary/ansys.aedt.core.hfss.Hfss.create_setup.html",
      "source_type": "official_documentation",
      "product": "PyAEDT",
      "product_version": "stable as accessed 2026-08-21",
      "license": "Ansys documentation terms; verify before redistribution"
    },
    {
      "source_id": "pyaedt_hfss_export_touchstone",
      "url": "https://aedt.docs.pyansys.com/version/stable/API/_autosummary/ansys.aedt.core.hfss.Hfss.export_touchstone.html",
      "source_type": "official_documentation",
      "product": "PyAEDT",
      "product_version": "stable as accessed 2026-08-21",
      "license": "Ansys documentation terms; verify before redistribution"
    },
    {
      "source_id": "pyaedt_probe_fed_patch_example",
      "url": "https://examples.aedt.docs.pyansys.com/version/dev/examples/high_frequency/antenna/patch.html",
      "source_type": "official_example",
      "product": "PyAEDT Examples",
      "product_version": "development documentation as accessed 2026-08-21",
      "license": "Ansys example documentation terms; verify before redistribution"
    }
  ]
}
