{
  "knowledge_manifest_version": "1.0",
  "corpus_id": "pyaedt_minimal_fixture",
  "retrieved_at": "2026-08-21T02:00:00Z",
  "chunk_max_characters": 512,
  "documents": [
    {
      "source_id": "pyaedt_hfss_fixture",
      "url": "../../tests/fixtures/pyaedt_api_minimal.html",
      "source_type": "local_fixture",
      "product": "PyAEDT",
      "product_version": "2025.2-contract-fixture",
      "license": "repository test fixture"
    }
  ]
}
